pair,combo,id,reasons,short_preview
"moon_neptune","virgo_pisces","72","short words: 10 (need 12-25)","Может забыть про собственный обед, вытирая слёзы подруге по телефону."
"moon_neptune","libra_cancer","76","banned: ""будет""","Старается угодить всем вокруг, но внутри очень раним и нуждается в тихом уюте и "
"moon_neptune","libra_virgo","78","banned: ""быть собой""","Хочет всем угодить, но внутренний критик мешает расслабиться и быть собой в комп"
"moon_neptune","libra_sagittarius","81","full words: 96 (need 50-80)","Может убедить кого угодно поехать в спонтанное путешествие, а потом сам же предл"
"moon_neptune","libra_capricorn","82","full words: 88 (need 50-80)","Предпочитает держать чувства при себе, но ждёт, что окружающие сами догадаются о"
"moon_neptune","libra_aquarius","83","full words: 81 (need 50-80)","Увлекается идеями, которые кажутся другим слишком смелыми, но редко бросает нача"
"moon_neptune","libra_pisces","84","full words: 95 (need 50-80)","Подолгу выбирает подарок для друга, а потом дарит что-то совсем неожиданное, но "
"moon_neptune","scorpio_virgo","90","short words: 10 (need 12-25)","Помнит каждую мелочь и анализирует поступки других с беспощадной дотошностью."
"moon_neptune","sagittarius_cancer","100","banned: ""будет""","Внешне лёгкий и открытый, но внутри всё пропускает через личные переживания и ну"
"moon_neptune","sagittarius_leo","101","full words: 83 (need 50-80)","Сначала загорается идеей, потом заражает ею всех вокруг и ведёт за собой."
"moon_neptune","sagittarius_virgo","102","full words: 85 (need 50-80)","Планирует каждую деталь своего приключения, но так и не решается тронуться в пут"
"moon_neptune","sagittarius_libra","103","full words: 83 (need 50-80)","Легко сходится с людьми, но долго решает, можно ли им доверять по-настоящему."
"moon_neptune","sagittarius_capricorn","106","full words: 83 (need 50-80)","Сначала обещает себе всё бросить и уехать к морю, а потом до ночи сидит с таблиц"
"moon_neptune","sagittarius_aquarius","107","full words: 87 (need 50-80)","Загорается идеей изменить мир, а через час уже придумывает новый проект, забыв о"
"moon_neptune","sagittarius_pisces","108","full words: 86 (need 50-80)","Верит, что случайные встречи — это знаки судьбы, и часто ошибается, но не разоча"
"moon_neptune","capricorn_cancer","112","banned: ""быть собой""","Выглядит несгибаемым, но в душе очень раним и нуждается в заботе и тепле."
"moon_neptune","capricorn_leo","113","short words: 10 (need 12-25)","Мечтает о всеобщем признании, но никогда не попросит похвалы вслух."
"moon_neptune","capricorn_virgo","114","short words: 10 (need 12-25)","Перепроверяет всё по три раза и молча исправляет чужие ошибки."
"moon_neptune","capricorn_scorpio","116","short words: 11 (need 12-25); banned: ""будет""","Никогда не показывает истинной силы своих чувств, но помнит каждую обиду."
"moon_neptune","capricorn_sagittarius","117","short words: 11 (need 12-25)","Составляет подробный список дел на день, а потом делает всё наоборот."
"moon_neptune","capricorn_capricorn","118","short words: 11 (need 12-25)","Всё проверяет по три раза, даже если никто не заметит ошибки."
"moon_neptune","capricorn_aquarius","119","short words: 11 (need 12-25)","Сначала всё планирует до мелочей, а потом бросает ради спонтанной идеи."
"moon_neptune","aquarius_taurus","122","banned: ""будет""","Мечтает о необычной жизни, но при этом ценит домашний уют и привычный распорядок"
"moon_neptune","aquarius_leo","125","banned: ""быть собой""","Может затеять революцию в компании, а потом обидеться, что никто не оценил его к"
"moon_neptune","aquarius_virgo","126","short words: 11 (need 12-25); banned: ""будет""","Придумает гениальную систему хранения вещей, но забудет положить их на место."
"moon_neptune","aquarius_libra","127","short words: 11 (need 12-25); banned: ""будет""","Предложит помириться за чаем с необычными пирожными, чтобы всем было комфортно."
"moon_neptune","aquarius_scorpio","128","banned: ""глубина""","Может часами изучать тёмную сторону человека, но сам откроется только если почув"
"moon_neptune","pisces_libra","139","short words: 11 (need 12-25)","Готов выслушать кого угодно, но свои слёзы прячет за красивой картинкой."
"moon_neptune","pisces_scorpio","140","short words: 10 (need 12-25)","Может молча переживать бурю внутри, а потом неожиданно всё изменить."
"moon_neptune","pisces_sagittarius","141","full words: 89 (need 50-80)","Готов сорваться вслед за мечтой, не имея чёткого плана, и надеется, что разберёт"
"moon_neptune","pisces_capricorn","142","full words: 81 (need 50-80)","Выглядит рассудительным и надёжным, пока в тишине не начинает сомневаться в смыс"
"moon_neptune","pisces_pisces","144","full words: 84 (need 50-80)","Впитывает настроение комнаты как губка, а потом не может понять, где его собстве"
"moon_pluto","aries_aries","1","banned: ""будет""","Может согласиться на авантюру за пять минут, а уже вечером разбираться с последс"
"moon_pluto","aries_cancer","4","short words: 11 (need 12-25)","Сначала действует на эмоциях, потом переживает, не ранил ли кого-то случайно."
"moon_pluto","aries_virgo","6","short words: 11 (need 12-25)","Сначала делает шаг вперёд, а потом долго проверяет, правильно ли ступил."
"moon_pluto","aries_libra","7","short words: 9 (need 12-25)","Хочет быть решающим, но боится испортить отношения с окружающими."
"moon_pluto","aries_sagittarius","9","short words: 11 (need 12-25)","Срывается в спонтанную поездку без плана, уверенный, что разберётся на месте."
"moon_pluto","taurus_taurus","14","banned: ""будет""","Никогда не меняет своего мнения под давлением — только если сам к этому придёт."
"moon_pluto","taurus_virgo","18","banned: ""будет""","Всё доводит до совершенства и сильно переживает из-за малейшего беспорядка — как"
"moon_pluto","taurus_sagittarius","21","full words: 86 (need 50-80)","Ценит привычный уют, но раз за разом соглашается на авантюры, которые ломают все"
"moon_pluto","taurus_capricorn","22","banned: ""будет""","Медленно, но неотвратимо строит свою империю и не успокаивается, пока цель не бу"
"moon_pluto","taurus_aquarius","23","short words: 11 (need 12-25); full words: 90 (need 50-80)","Стремится к стабильности, но одновременно хочет всё перевернуть и построить зано"
"moon_pluto","taurus_pisces","24","full words: 105 (need 50-80)","Кажется спокойным и даже немного флегматичным, но внутри у него бушуют мощные чу"
"moon_pluto","gemini_taurus","26","banned: ""будет""","Может долго сомневаться перед переменой, а потом внезапно решить — и уже не отст"
"moon_pluto","gemini_virgo","30","banned: ""будет""","Всё анализирует до мелочей и переживает, если в его словах находят хоть одну нет"
"moon_pluto","gemini_aquarius","35","banned: ""уникальность""","Может спорить до хрипоты о том, что ему самому не очень-то и важно, просто ради "
"moon_pluto","cancer_taurus","38","full words: 90 (need 50-80)","Долго присматривается к человеку, а потом уже не хочет никого другого — даже есл"
"moon_pluto","cancer_gemini","39","full words: 90 (need 50-80)","Сначала ищет близости, а потом резко замыкается — и сам не знает, почему так выш"
"moon_pluto","cancer_cancer","40","full words: 83 (need 50-80)","Всё пропускает через себя и помнит каждую мелочь — даже то, о чём сам предпочёл "
"moon_pluto","cancer_scorpio","44","short words: 10 (need 12-25)","Не прощает предательства, но сам проверяет отношения на прочность молчанием."
"moon_pluto","leo_taurus","50","short words: 11 (need 12-25)","Ценит комфорт и признание, но менять что-то ради этого не спешит."
"moon_pluto","leo_gemini","51","banned: ""будет""","Может быть душой компании, но через час уже искать новую аудиторию для своих иде"
"moon_pluto","leo_leo","53","full words: 85 (need 50-80)","Ему нужно быть в центре внимания, и он добьётся этого любой ценой, даже если при"
"moon_pluto","leo_virgo","54","full words: 91 (need 50-80)","Стремится к идеалу во всём и готов бесконечно шлифовать детали, лишь бы не удари"
"moon_pluto","leo_libra","55","full words: 85 (need 50-80)","Очаровывает с первого взгляда, но внутри постоянно сомневается, достаточно ли он"
"moon_pluto","leo_scorpio","56","full words: 94 (need 50-80)","Внешне спокоен и величественен, но внутри кипят такие страсти, что он сам их бои"
"moon_pluto","leo_pisces","60","banned: ""будет""","Мечтает быть единственным и неповторимым, но при этом искренне хочет сделать мир"
"moon_pluto","virgo_taurus","62","banned: ""будет""","Всё делает основательно и терпеть не может, когда кто-то нарушает его годами выс"
"moon_pluto","virgo_leo","65","full words: 82 (need 50-80)","Старается сделать всё идеально, но втайне надеется, что это заметят и похвалят."
"moon_pluto","virgo_virgo","66","banned: ""будет""","Не успокоится, пока всё вокруг не будет идеально выверено и разложено по местам."
"moon_pluto","virgo_libra","67","short words: 11 (need 12-25)","Долго выбирает между тем, что правильно, и тем, что понравится другим."
"moon_pluto","virgo_sagittarius","69","full words: 86 (need 50-80)","Купит путеводитель, изучит карту, а в последний момент решит просто пойти наобум"
"moon_pluto","virgo_capricorn","70","full words: 86 (need 50-80); banned: ""будет""","Составит график уборки на год вперёд и будет красноречиво молчать, если кто-то н"
"moon_pluto","virgo_pisces","72","full words: 86 (need 50-80)","Может часами вытирать пыль и при этом слушать грустные песни, едва сдерживая слё"
"moon_pluto","libra_virgo","78","full words: 81 (need 50-80); banned: ""будет""","Может соглашаться ради гармонии, но потом мысленно перебирать все недостатки это"
"moon_pluto","libra_scorpio","80","full words: 81 (need 50-80)","Может быть обходительным и милым, пока внутри себя не решит, что с этого человек"
"moon_pluto","libra_sagittarius","81","full words: 91 (need 50-80)","Легко сходится с людьми, но быстро теряет к ним интерес, если общение начинает т"
"moon_pluto","libra_capricorn","82","banned: ""будет""","Сначала взвешивает все за и против, а потом принимает решение и редко его пересм"
"moon_pluto","libra_aquarius","83","full words: 86 (need 50-80); banned: ""быть собой""","Спокойно воспринимает чужие странности, если они не нарушают его личное простран"
"moon_pluto","libra_pisces","84","full words: 88 (need 50-80)","Старается угодить всем, а потом удивляется, почему его собственные желания остал"
"moon_pluto","scorpio_aries","85","full words: 49 (need 50-80)","Если его задеть, ответит так, что больше не захочется проверять — и сам удивится"
"moon_pluto","scorpio_taurus","86","banned: ""будет""","Спокоен снаружи, но внутри переживает так глубоко, что может годами помнить стар"
"moon_pluto","sagittarius_aries","97","full words: 88 (need 50-80)","Не боится говорить прямо, даже если это создаёт неудобства. Сначала делает, пото"
"moon_pluto","sagittarius_taurus","98","full words: 96 (need 50-80)","Хочет попробовать всё, но не терпит спешки. Сначала упирается, потом медленно пр"
"moon_pluto","sagittarius_gemini","99","full words: 101 (need 50-80)","Меняет мнение несколько раз за день, но искренне верит в каждое новое. Ищет сист"
"moon_pluto","sagittarius_cancer","100","full words: 92 (need 50-80); banned: ""будет""","Кажется независимым, но остро нуждается в принятии. Заботлив только с проверенны"
"moon_pluto","sagittarius_virgo","102","short words: 11 (need 12-25); full words: 88 (need 50-80)","Стремится к порядку, но импульсивно нарушает собственные планы ради новых впечат"
"moon_pluto","sagittarius_libra","103","short words: 9 (need 12-25); full words: 84 (need 50-80)","Ищет равновесие между жаждой свободы и желанием всем угодить."
"moon_pluto","sagittarius_scorpio","104","full words: 85 (need 50-80)","Скрывает ранимость за маской спокойствия, но внутри всё воспринимает близко к се"
"moon_pluto","capricorn_aries","109","short words: 11 (need 12-25)","Долго вынашивает план, но потом действует так резко, что сам удивляется."
"moon_pluto","capricorn_taurus","110","short words: 10 (need 12-25); banned: ""будет""","Делает всё медленно, но так, что потом не приходится переделывать."
"moon_pluto","capricorn_gemini","111","short words: 11 (need 12-25)","Ставит строгие сроки, но сам постоянно меняет планы по ходу дела."
"moon_pluto","capricorn_cancer","112","short words: 11 (need 12-25)","Снаружи — крепкая стена, внутри — забота, которую прячет за делами."
"moon_pluto","capricorn_libra","115","short words: 10 (need 12-25)","Ценит гармонию и справедливость, но внутри жёстко контролирует свои эмоции."
"moon_pluto","capricorn_capricorn","118","short words: 11 (need 12-25)","Может трижды перепроверить документы перед отправкой, но пропустить дедлайн из-з"
"moon_pluto","aquarius_taurus","122","banned: ""будет""; banned: ""фундамент""","Перестраивает жизнь по собственным чертежам и не отступает, пока всё не будет ид"
"moon_pluto","aquarius_cancer","124","short words: 9 (need 12-25)","Свободолюбивый одиночка, который втайне мечтает о глубокой эмоциональной привяза"
"moon_pluto","aquarius_leo","125","full words: 88 (need 50-80)","Способен загореться необычной идеей и увлечь за собой всех вокруг, но терпеть не"
"moon_pluto","aquarius_virgo","126","full words: 86 (need 50-80)","Любит придумывать нестандартные решения, но требует, чтобы каждая мелочь была ид"
"moon_pluto","aquarius_libra","127","short words: 11 (need 12-25); full words: 85 (need 50-80)","Стремится к справедливости, но часто ставит свои принципы выше чужих интересов."
"moon_pluto","aquarius_scorpio","128","full words: 97 (need 50-80)","Видит вещи глубже других и не боится разрушать устаревшие структуры ради нового "
"moon_pluto","aquarius_aquarius","131","short words: 11 (need 12-25)","Упрямо отстаивает нестандартные идеи, но тяжело переживает, когда его свободу ог"
"moon_pluto","pisces_virgo","138","short words: 11 (need 12-25)","Пытается упорядочить свои глубокие чувства через заботу о других и перфекционизм"
"moon_pluto","pisces_scorpio","140","banned: ""глубина""","Чувствует людей насквозь и переживает эмоции так глубоко, что это пугает окружаю"
"moon_pluto","pisces_capricorn","142","short words: 11 (need 12-25); full words: 85 (need 50-80)","Строит воздушные замки, но нанимает бетономешалку, чтобы возвести их на земле."
"moon_pluto","pisces_aquarius","143","short words: 11 (need 12-25); full words: 92 (need 50-80)","Придумывает идеи, которые спасут мир, но забывает пообедать, пока записывает их."
"moon_pluto","pisces_pisces","144","full words: 88 (need 50-80)","Смотрит кино и чувствует себя главным героем, а после титров не помнит, кто он н"
"moon_saturn","aries_aries","1","short words: 10 (need 12-25)","Сначала действует, потом разбирается с последствиями, но всегда держит слово."
"moon_saturn","aries_gemini","3","short words: 11 (need 12-25)","Схватывает на лету, быстро переключается, но может растерять запал без новизны."
"moon_saturn","aries_cancer","4","short words: 10 (need 12-25); banned: ""будет""","Под внешней жёсткостью прячет ранимость и долго не решается открыться."
"moon_saturn","aries_leo","5","full words: 96 (need 50-80)","Сначала действует, потом думает, но никогда не признаёт, что погорячился — слишк"
"moon_saturn","aries_virgo","6","full words: 86 (need 50-80)","Начинает с энтузиазмом, а потом тратит уйму времени на проверку мелочей, которые"
"moon_saturn","aries_sagittarius","9","short words: 10 (need 12-25)","Начинает десяток проектов одновременно и искренне удивляется, что не успевает."
"moon_saturn","aries_capricorn","10","short words: 11 (need 12-25)","Быстро принимает решения, потом долго разбирается с последствиями, но редко жале"
"moon_saturn","aries_pisces","12","short words: 11 (need 12-25)","Может вспылить из-за пустяка, а потом долго корить себя за резкость."
"moon_saturn","taurus_taurus","14","banned: ""будет""","Если он решил, что сегодня будет борщ — будет борщ, даже если весь мир против."
"moon_saturn","taurus_libra","19","key mismatch: signpair.moon_saturn.taurus_li bra → signpair.moon_saturn.taurus_libra","Соглашается ради спокойствия, но потом возвращается к той же теме и доказывает с"
"moon_saturn","taurus_sagittarius","21","full words: 87 (need 50-80)","Может год откладывать на новый диван, а потом купить вместо него палатку и уехат"
"moon_saturn","taurus_pisces","24","short words: 11 (need 12-25); full words: 83 (need 50-80)","Может часами слушать чужие проблемы, а потом внезапно исчезнуть на неделю."
"moon_saturn","gemini_aries","25","banned: ""энергия""","Сначала ввязывается в разговор или дело, а уже потом соображает, стоило ли это д"
"moon_saturn","gemini_leo","29","full words: 90 (need 50-80)","Загорится идеей за минуту, но остынет раньше, чем до неё дойдут руки."
"moon_saturn","gemini_virgo","30","full words: 91 (need 50-80)","Проверяет каждую мелочь, прежде чем сказать хоть слово, и всё равно сомневается."
"moon_saturn","gemini_libra","31","short words: 9 (need 12-25); full words: 91 (need 50-80); banned: ""будет""","Балансирует между желанием всем угодить и необходимостью принимать решения."
"moon_saturn","gemini_scorpio","32","short words: 8 (need 12-25); full words: 96 (need 50-80); banned: ""будет""","Видит людей насквозь, но сам предпочитает оставаться загадкой."
"moon_saturn","cancer_virgo","42","short words: 10 (need 12-25)","Беспокоится по любому поводу и проверяет всё по десять раз."
"moon_saturn","cancer_libra","43","short words: 10 (need 12-25)","Долго терпит неудобства ради мира, а потом взрывается из-за ерунды."
"moon_saturn","cancer_sagittarius","45","full words: 102 (need 50-80); banned: ""будет""","Может мечтать о кругосветном путешествии, а через час переживать из-за забытого "
"moon_saturn","cancer_capricorn","46","short words: 11 (need 12-25); full words: 100 (need 50-80)","Внешне держится уверенно и собранно, но внутри переживает каждое сказанное слово"
"moon_saturn","cancer_aquarius","47","full words: 95 (need 50-80)","Может часами говорить о будущем человечества, но замолкает, когда речь заходит о"
"moon_saturn","cancer_pisces","48","full words: 90 (need 50-80)","Легко чувствует чужое настроение, но не всегда понимает, где заканчиваются други"
