pair,combo,id,reasons,short_preview
"asc_sun","gemini_aquarius","35","full words: 94 (need 50-80)","С ним можно говорить о чём угодно, но он редко дослушивает до конца — уже придум"
"asc_sun","gemini_pisces","36","full words: 100 (need 50-80)","Он понимает людей с полуслова, но сам не всегда знает, чего хочет через пять мин"
"asc_sun","cancer_gemini","39","full words: 84 (need 50-80)","Общительный и любознательный, но ранимый — легко откроется и тут же захлопнется."
"asc_sun","cancer_leo","41","short words: 11 (need 12-25)","За внешней мягкостью скрывается потребность быть замеченным и оценённым по досто"
"asc_sun","cancer_virgo","42","short words: 11 (need 12-25)","Заботится через дела и порядок, но его требовательность может ранить близких."
"asc_sun","cancer_libra","43","short words: 11 (need 12-25)","Избегает конфликтов любой ценой, но внутри переживает из-за каждого неосторожног"
"asc_sun","cancer_scorpio","44","short words: 10 (need 12-25)","Внешне спокоен, но внутри бушуют страсти — довериться ему непросто."
"asc_sun","cancer_aquarius","47","full words: 49 (need 50-80)","Кажется открытым и дружелюбным, но впускает в свою жизнь далеко не каждого."
"asc_sun","leo_aries","49","short words: 10 (need 12-25)","Сразу бросается в бой, но обижается, если никто не аплодирует."
"asc_sun","leo_taurus","50","short words: 8 (need 12-25)","Медленно разгоняется, но если упёрся — переубедить невозможно."
"asc_sun","leo_gemini","51","short words: 8 (need 12-25)","Зажигает любую компанию, но редко досиживает до финала."
"asc_sun","leo_cancer","52","short words: 11 (need 12-25)","Хочет быть звездой, но при этом боится, что его не поймут."
"asc_sun","leo_leo","53","banned: ""будет""","Он привык быть на виду и редко сомневается в своём праве на внимание и восхищени"
"asc_sun","leo_capricorn","58","banned: ""будет""","Сначала долго взвешивает риски, а потом действует так, будто всё было очевидно с"
"asc_sun","virgo_gemini","63","banned: ""будет""","Может увлечься разбором чужого аргумента так, что забудет, зачем вообще затеял с"
"asc_sun","libra_virgo","78","short words: 10 (need 12-25)","Прежде чем ответить, взвешивает каждое слово и ищет безупречную формулировку."
"asc_sun","libra_libra","79","banned: ""будет""","Может часами выбирать между двумя вариантами, чтобы никого не обидеть и сохранит"
"asc_sun","scorpio_aries","85","short words: 11 (need 12-25)","Долго копит напряжение, а потом действует резко и неожиданно для всех."
"asc_sun","scorpio_taurus","86","short words: 11 (need 12-25)","Никогда не сдаётся и не прощает тех, кто перешёл ему дорогу."
"asc_sun","scorpio_gemini","87","short words: 7 (need 12-25)","Проницательный собеседник, который видит больше, чем говорит."
"asc_sun","scorpio_cancer","88","short words: 11 (need 12-25); full words: 49 (need 50-80)","С виду неприступен, но внутри — ранимый и очень преданный близким."
"asc_sun","scorpio_virgo","90","short words: 11 (need 12-25)","Подмечает любую нестыковку и молча делает выводы, которые редко кого щадят."
"asc_sun","scorpio_scorpio","92","short words: 10 (need 12-25)","Молча наблюдает, запоминает каждую мелочь и никогда ничего не забывает."
"asc_sun","scorpio_pisces","96","banned: ""внутренний стержень""","Может раствориться в чужих проблемах, но в критический момент соберётся и примет"
"asc_sun","sagittarius_taurus","98","banned: ""будет""","Готов пуститься в авантюру, но не раньше, чем проверит, будет ли там вкусный ужи"
"asc_sun","sagittarius_gemini","99","full words: 85 (need 50-80)","Искры летят в разговоре, но он так быстро меняет тему, что никто не успевает вст"
"asc_sun","sagittarius_libra","103","short words: 11 (need 12-25)","Готов выслушать любую точку зрения, пока она не противоречит его принципам."
"asc_sun","sagittarius_scorpio","104","short words: 11 (need 12-25)","Ищет истину с такой страстью, что иногда пугает окружающих своей одержимостью."
"asc_sun","sagittarius_capricorn","106","short words: 9 (need 12-25)","Строит наполеоновские планы, но внутри всё равно остаётся авантюристом."
"asc_sun","sagittarius_aquarius","107","short words: 10 (need 12-25); banned: ""будет""","Загорается новой идеей, но быстро остывает, если не находит единомышленников."
"asc_sun","sagittarius_pisces","108","short words: 9 (need 12-25)","Мечтает о приключениях, но часто тонет в собственных сомнениях."
"asc_sun","capricorn_aries","109","full words: 47 (need 50-80)","Планирует каждый шаг, но в последнюю минуту может сорваться и сделать всё по-сво"
"asc_sun","aquarius_taurus","122","short words: 10 (need 12-25); banned: ""будет""","Упрямо отстаивает свои взгляды, даже если они противоречат общепринятым нормам."
"asc_sun","aquarius_gemini","123","short words: 9 (need 12-25)","Обожает обсуждать идеи, которые другим кажутся странными или бессмысленными."
"asc_sun","aquarius_leo","125","short words: 9 (need 12-25)","Хочет признания, но презирает попытки его заслужить любой ценой."
"asc_sun","aquarius_virgo","126","short words: 9 (need 12-25)","Любит порядок, но только тот, который сам себе установил."
"asc_sun","aquarius_libra","127","short words: 9 (need 12-25)","Мягко уходит от конфликтов, даже когда внутри всё кипит."
"asc_sun","aquarius_scorpio","128","short words: 10 (need 12-25)","Не показывает чувств, пока не убедится, что его не предадут."
"asc_sun","aquarius_capricorn","130","short words: 11 (need 12-25)","Может составить детальный бизнес-план, а потом внезапно изменить его ради экспер"
"asc_sun","aquarius_aquarius","131","full words: 81 (need 50-80)","Может обсуждать теорию хаоса за ужином, а через час предлагать сыграть в настоль"
"asc_sun","aquarius_pisces","132","short words: 11 (need 12-25); full words: 82 (need 50-80)","Может часами слушать чужие переживания, а потом предложить неожиданное решение п"
"asc_sun","pisces_gemini","135","full words: 82 (need 50-80)","Может загореться идеей за минуту, а через час уже думать о чём-то совершенно дру"
"asc_sun","pisces_leo","137","banned: ""будет""","Ему нужно признание, но он не будет требовать его громко — скорее, просто сделае"
"asc_sun","pisces_virgo","138","full words: 84 (need 50-80)","Прежде чем решиться, прокручивает в голове все варианты — и часто находит пробле"
"asc_sun","pisces_scorpio","140","banned: ""будет""","Сначала долго присматривается к человеку, а если тот его задел — запоминает надо"
"asc_uranus","aries_aries","1","short words: 11 (need 12-25)","Сначала прыгает, потом смотрит, куда прыгнул, и редко жалеет об этом."
"asc_uranus","aries_cancer","4","full words: 81 (need 50-80)","Резко бросается защищать близких, но потом долго переживает, не перегнул ли палк"
"asc_uranus","aries_capricorn","10","short words: 11 (need 12-25)","Сначала делает, потом думает — но думает так, будто планировал месяц."
"asc_uranus","aries_aquarius","11","banned: ""будет""","Может ввязаться в эксперимент, о котором через неделю сам забудет, но будет вспо"
"asc_uranus","taurus_taurus","14","full words: 81 (need 50-80)","Меняет привычки только в крайнем случае, и даже тогда делает это медленно и неох"
"asc_uranus","taurus_gemini","15","full words: 81 (need 50-80)","Стабильный в привычках, но с неожиданными интересами, которые могут резко перекл"
"asc_uranus","taurus_virgo","18","full words: 88 (need 50-80)","Всё делает основательно, но при этом постоянно замечает мелкие недочёты и молча "
"asc_uranus","taurus_libra","19","full words: 87 (need 50-80)","Стремится к красоте и гармонии, но при этом очень не любит, когда его доброту пр"
"asc_uranus","taurus_scorpio","20","full words: 90 (need 50-80)","Внешне спокоен, но внутри — настоящий вулкан, который просыпается только тогда, "
"asc_uranus","taurus_capricorn","22","short words: 10 (need 12-25)","Проверенные шаблоны переделывает под себя, но только ради чёткого результата."
"asc_uranus","gemini_gemini","27","banned: ""будет""","Меняет решения быстрее, чем успевает их произнести, и сам в них путается."
"asc_uranus","gemini_virgo","30","full words: 89 (need 50-80)","Пытается всё систематизировать, но в процессе постоянно находит новые способы сд"
"asc_uranus","gemini_libra","31","full words: 81 (need 50-80); banned: ""будет""","Может внезапно сменить тему разговора, чтобы сохранить мир, но сам от этого уста"
"asc_uranus","gemini_scorpio","32","full words: 85 (need 50-80)","Легко заводит интригующие разговоры, но предпочитает держать свои настоящие мысл"
"asc_uranus","gemini_pisces","36","short words: 11 (need 12-25)","Может говорить одновременно о серьёзном и фантастическом, сбивая с толку собесед"
"asc_uranus","cancer_taurus","38","short words: 10 (need 12-25)","Долго присматривается к новому, но если решился — стоит насмерть."
"asc_uranus","cancer_cancer","40","short words: 10 (need 12-25)","Цепляется за привычное, даже когда оно давно перестало приносить радость."
"asc_uranus","cancer_leo","41","short words: 11 (need 12-25); full words: 82 (need 50-80)","Сначала окружит заботой, а потом обидится, если не заметят его стараний."
"asc_uranus","cancer_virgo","42","short words: 10 (need 12-25); banned: ""будет""","Всё проверит несколько раз, чтобы потом не переживать из-за мелочей."
"asc_uranus","cancer_libra","43","short words: 10 (need 12-25); full words: 82 (need 50-80)","Умеет сгладить любой конфликт, но внутри может долго переживать обиду."
"asc_uranus","cancer_scorpio","44","banned: ""будет""","Долго присматривается к людям, но если доверится — будет предан до конца."
"asc_uranus","cancer_sagittarius","45","short words: 11 (need 12-25)","Мечтает о кругосветном путешествии, но берёт с собой плед и термос."
"asc_uranus","cancer_capricorn","46","short words: 9 (need 12-25)","Строит долгосрочные планы, чтобы в последний момент всё переиграть."
"asc_uranus","cancer_aquarius","47","banned: ""будет""","Домашний уют ему нужен, но жить по расписанию он всё равно не будет."
"asc_uranus","cancer_pisces","48","short words: 10 (need 12-25)","Чувствует всё настолько глубоко, что иногда сам пугается собственных эмоций."
"asc_uranus","leo_taurus","50","full words: 94 (need 50-80)","Хочет быть в центре внимания, но менять привычный уклад жизни не спешит."
"asc_uranus","leo_gemini","51","full words: 86 (need 50-80)","С лёгкостью меняет тему разговора и круг общения, но всегда остаётся душой компа"
"asc_uranus","leo_cancer","52","full words: 101 (need 50-80)","Может обидеться из-за мелочи, но сделает вид, что всё в порядке, пока не сорвётс"
"asc_uranus","leo_scorpio","56","short words: 11 (need 12-25)","Внешне сдержан, но внутри — вулкан амбиций и желания полного контроля."
"asc_uranus","leo_sagittarius","57","short words: 11 (need 12-25); full words: 89 (need 50-80)","Хочет везде успеть, всем понравиться и при этом никому не подчиняться."
"asc_uranus","leo_capricorn","58","full words: 85 (need 50-80)","Строит грандиозные планы на годы вперёд, но требует, чтобы все признали его гени"
"asc_uranus","leo_pisces","60","full words: 86 (need 50-80)","Мечтает о сцене и овациях, но часто остаётся за кулисами в ожидании подходящего "
"asc_uranus","virgo_aries","61","full words: 87 (need 50-80)","Продумывает всё до мелочей, но в последний момент может резко сменить курс."
"asc_uranus","virgo_taurus","62","short words: 11 (need 12-25)","Долго копит недовольство рутиной, а потом резко меняет всё одним рывком."
"asc_uranus","virgo_gemini","63","short words: 11 (need 12-25); full words: 82 (need 50-80)","Может одновременно работать над тремя проектами и ни один не закончить."
"asc_uranus","virgo_cancer","64","full words: 83 (need 50-80)","Создаёт уют и порядок, но может всё перевернуть из-за внезапной смены настроения"
"asc_uranus","virgo_libra","67","banned: ""будет""","Часами выбирает ресторан для встречи с друзьями, чтобы устроить всех и не ошибит"
"asc_uranus","virgo_scorpio","68","banned: ""будет""","Молча наблюдает за новым коллегой месяц, чтобы понять, можно ли ему доверять раб"
"asc_uranus","virgo_aquarius","71","short words: 11 (need 12-25)","Может придумать гениальный план, но потратит час на проверку каждой мелочи."
"asc_uranus","virgo_pisces","72","short words: 9 (need 12-25)","Может часами анализировать ситуацию, а потом принять решение сердцем."
"asc_uranus","libra_aries","73","banned: ""будет""","Сначала долго взвешивает все «за» и «против», а потом делает нечто совершенно не"
"asc_uranus","libra_cancer","76","short words: 9 (need 12-25); banned: ""будет""","Старается никого не задеть, но внутри обиды помнит годами."
"asc_uranus","libra_scorpio","80","banned: ""глубина""","Улыбается и поддерживает светскую беседу, а сам уже мысленно составил ваш психол"
"asc_uranus","libra_sagittarius","81","short words: 10 (need 12-25)","Дипломатично предлагает рискованный план, но сам удивляется, когда другие соглаш"
"asc_uranus","libra_capricorn","82","short words: 11 (need 12-25)","Планирует всё до мелочей, но в последний момент меняет правила игры."
"asc_uranus","libra_aquarius","83","short words: 9 (need 12-25)","Обсуждает справедливое будущее с таким жаром, что забывает поужинать."
"asc_uranus","libra_pisces","84","short words: 9 (need 12-25)","Избегает споров, но может неожиданно раствориться в собственных фантазиях."
"asc_uranus","scorpio_gemini","87","short words: 10 (need 12-25)","Подмечает детали, которые другие пропускают, и любит разоблачать скрытые мотивы."
"asc_uranus","scorpio_sagittarius","93","short words: 10 (need 12-25); full words: 84 (need 50-80)","Может резко сменить тему разговора, если чувствует фальшь или скуку."
"asc_uranus","scorpio_aquarius","95","full words: 82 (need 50-80)","Может часами молчать в компании, а потом выдать идею, которая перевернёт всё с н"
"asc_uranus","scorpio_pisces","96","short words: 9 (need 12-25); full words: 83 (need 50-80)","Может выглядеть рассеянным, но замечает детали, которые другие упускают."
"asc_uranus","sagittarius_scorpio","104","short words: 11 (need 12-25)","Увлекается идеей так сильно, что готов рискнуть всем ради её воплощения."
"asc_uranus","sagittarius_capricorn","106","banned: ""ресурс""","Мечтает о большом, но делает маленькие, уверенные шаги, не отвлекаясь на пустяки"
"asc_uranus","capricorn_taurus","110","short words: 10 (need 12-25)","Упрямый, не любит спешки и перемен, предпочитает всё тщательно обдумывать."
"asc_uranus","capricorn_cancer","112","short words: 11 (need 12-25)","Выглядит неприступным, но внутри очень раним и остро нуждается в поддержке."
"asc_uranus","capricorn_scorpio","116","banned: ""будет""","Спокойный снаружи, но внутри — напряжённый и готовый к любым неожиданностям чело"
"asc_uranus","capricorn_capricorn","118","banned: ""будет""","Если он что-то запланировал, то это будет сделано — даже если придётся не спать."
"asc_uranus","aquarius_aries","121","banned: ""будет""","Мгновенно загорается новой идеей, бросается её реализовывать, а через неделю мож"
"asc_uranus","aquarius_gemini","123","short words: 11 (need 12-25); full words: 81 (need 50-80)","Говорит быстрее, чем думает, и постоянно перескакивает с темы на тему."
"asc_uranus","aquarius_cancer","124","short words: 11 (need 12-25); full words: 85 (need 50-80)","Внешне кажется отстранённым, но внутри переживает всё очень глубоко и долго."
"asc_uranus","aquarius_leo","125","short words: 11 (need 12-25)","Увлекается необычными идеями, но быстро теряет интерес, если не получает признан"
"asc_uranus","aquarius_virgo","126","short words: 11 (need 12-25)","Сочетает любовь к экспериментам с дотошным вниманием к деталям и порядку."
"asc_uranus","aquarius_libra","127","short words: 10 (need 12-25)","Генерирует необычные идеи, но подаёт их мягко, стараясь сохранить гармонию."
"asc_uranus","aquarius_capricorn","130","short words: 11 (need 12-25)","Свои смелые идеи он реализует методично, превращая бунт в работающую систему."
"asc_uranus","aquarius_aquarius","131","short words: 10 (need 12-25)","Его идеи опережают время, а поступки редко поддаются логике окружающих."
"asc_uranus","aquarius_pisces","132","short words: 10 (need 12-25)","Его решения кажутся спонтанными и необъяснимыми даже для него самого."
"asc_uranus","pisces_gemini","135","full words: 88 (need 50-80)","Любопытный и переменчивый, он меняет интересы быстрее, чем погода. Его обаяние и"
"asc_uranus","pisces_virgo","138","short words: 11 (need 12-25)","Мечтатель с внутренним критиком: хочет творить, но застревает в бесконечных прав"
"asc_uranus","pisces_libra","139","banned: ""будет""","Ради мира вокруг готов пожертвовать своими желаниями, а потом долго переживать в"
"asc_uranus","pisces_capricorn","142","full words: 48 (need 50-80)","Сначала строит планы на десять лет вперёд, а потом вдруг решает всё переиграть."
"asc_uranus","pisces_aquarius","143","full words: 48 (need 50-80)","Может быть бесконечно преданным идее, но при этом удивлять внезапной сменой курс"
"asc_venus","aries_taurus","2","full words: 82 (need 50-80)","Хочет всё решить мгновенно, но потом долго проверяет, не ошибся ли в расчётах."
"asc_venus","aries_leo","5","full words: 86 (need 50-80)","Загорается идеей за секунду и ведёт за собой, но обижается, если его старания не"
"asc_venus","aries_libra","7","full words: 84 (need 50-80)","Любит красивые жесты и мирную атмосферу, но взрывается, если чувствует давление "
"asc_venus","aries_scorpio","8","full words: 86 (need 50-80); banned: ""будет""","Внешне кажется дерзким, но в глубине души — ранимый и недоверчивый, с острым чут"
"asc_venus","aries_sagittarius","9","short words: 9 (need 12-25)","Он загорается идеей быстрее, чем кто-либо успевает её осмыслить."
"asc_venus","taurus_taurus","14","banned: ""будет""","Готов ждать хорошего столько, сколько потребуется, и не меняет своих привычек де"
"asc_venus","taurus_aquarius","23","banned: ""будет""","Может упрямо отстаивать привычный порядок, а потом резко сменить всё в погоне за"
"asc_venus","taurus_pisces","24","full words: 81 (need 50-80)","Создаёт уютный мирок для себя и близких, но внутри него бурлит целый океан чувст"
"asc_venus","gemini_aries","25","short words: 11 (need 12-25)","Загорается новой идеей, пока не устанет — бросает, чтобы начать следующую."
