pair,combo,id,reasons,short_preview
"mars_uranus","cancer_scorpio","44","short words: 11 (need 12-25)","Переживает обиды молча, а потом решает всё кардинально изменить без предупрежден"
"mars_uranus","cancer_sagittarius","45","full words: 86 (need 50-80)","Может купить билет в неизвестном направлении, а уже в аэропорту пожалеть, что не"
"mars_uranus","cancer_capricorn","46","full words: 90 (need 50-80)","Выглядит спокойным и рассудительным, пока внутри не накопится достаточно напряже"
"mars_uranus","cancer_aquarius","47","full words: 85 (need 50-80); banned: ""будет""","Может внезапно уехать в другой город, а через неделю вернуться, потому что соску"
"mars_uranus","cancer_pisces","48","banned: ""быть собой""","Может вдохновиться случайной фразой и создать нечто удивительное, а потом забыть"
"mars_uranus","leo_aries","49","short words: 11 (need 12-25); full words: 90 (need 50-80)","Загорается идеей и сразу берётся за дело, не дожидаясь одобрения окружающих."
"mars_uranus","leo_taurus","50","short words: 9 (need 12-25); full words: 84 (need 50-80); banned: ""ресурс""","Упорно строит своё благополучие и ждёт признания своих трудов."
"mars_uranus","leo_gemini","51","short words: 10 (need 12-25); banned: ""уникальность""","Привлекает внимание остроумием и неожиданными идеями, но быстро теряет интерес."
"mars_uranus","leo_cancer","52","short words: 11 (need 12-25); full words: 85 (need 50-80)","Внешне спокоен, но внутри бурлит — обиды помнит долго и остро."
"mars_uranus","virgo_leo","65","short words: 10 (need 12-25)","Сначала перепроверит всё трижды, а потом устроит шоу из результата."
"mars_uranus","virgo_virgo","66","short words: 10 (need 12-25)","Не успокоится, пока не доведёт каждое действие до абсолютного совершенства."
"mars_uranus","virgo_libra","67","short words: 10 (need 12-25)","Ищет во всём гармонию, но дотошность мешает быстро принять решение."
"mars_uranus","virgo_scorpio","68","short words: 11 (need 12-25)","Всё помнит, всё анализирует и никогда не показывает истинной глубины чувств."
"mars_uranus","libra_aries","73","full words: 81 (need 50-80)","Может часами выбирать между двумя вариантами, а потом выбрать третий — самый нео"
"mars_uranus","libra_gemini","75","full words: 89 (need 50-80)","Может убедить кого угодно в чём угодно, а через час сам забыть, о чём говорил."
"mars_uranus","libra_cancer","76","full words: 84 (need 50-80)","Долго сохраняет вежливость, но если его задеть за живое — может неожиданно замкн"
"mars_uranus","libra_libra","79","full words: 82 (need 50-80); banned: ""быть собой""","Часто колеблется между двумя решениями, а когда выбирает — успевает пожалеть оба"
"mars_uranus","libra_capricorn","82","full words: 83 (need 50-80)","Сначала взвешивает все за и против, а потом действует решительно и без оглядки."
"mars_uranus","libra_aquarius","83","full words: 82 (need 50-80); banned: ""быть собой""","Может поддержать разговор о чём угодно, но резко замолкает, если чувствует давле"
"mars_uranus","libra_pisces","84","short words: 11 (need 12-25); full words: 83 (need 50-80)","Может часами слушать чужие истории, а потом неожиданно уйти гулять один."
"mars_uranus","scorpio_aries","85","short words: 11 (need 12-25)","Долго терпит, а потом взрывается так, что сам удивляется собственной ярости."
"mars_uranus","scorpio_gemini","87","short words: 11 (need 12-25)","Собирает секреты как коллекцию, но сам остаётся загадкой для всех вокруг."
"mars_uranus","scorpio_cancer","88","short words: 11 (need 12-25)","То ищет полного слияния, то резко отстраняется, чтобы не потерять себя."
"mars_uranus","scorpio_leo","89","banned: ""будет""","Не прощает предательства, но готов горы свернуть ради тех, кто однажды заслужил "
"mars_uranus","scorpio_virgo","90","full words: 91 (need 50-80)","Всё проверяет по несколько раз, а потом ещё раз, потому что спокойствие даёт тол"
"mars_uranus","scorpio_scorpio","92","full words: 82 (need 50-80); banned: ""энергия""","Ощущает всё острее других, но редко показывает уязвимость — даже близким сложно "
"mars_uranus","scorpio_pisces","96","short words: 11 (need 12-25)","Чувствует обстановку кожей и действует не напрямую, а через обходные манёвры."
"mars_uranus","sagittarius_aries","97","banned: ""будет""","Сначала бросается в новое дело, не разбирая деталей, и только потом понимает, во"
"mars_uranus","sagittarius_taurus","98","full words: 85 (need 50-80); banned: ""будет""","Поначалу кажется, что он легко загорается идеями, но на деле ему нужно время, чт"
"mars_uranus","sagittarius_gemini","99","full words: 82 (need 50-80)","Может за день переключиться с трёх разных увлечений и к вечеру придумать четвёрт"
"mars_uranus","sagittarius_cancer","100","full words: 83 (need 50-80)","Внешне кажется лёгким и открытым, но внутри всё пропускает через себя гораздо гл"
"mars_uranus","sagittarius_leo","101","full words: 90 (need 50-80)","Разжигает общее веселье так, будто от этого зависит жизнь, и искренне не понимае"
"mars_uranus","sagittarius_virgo","102","full words: 91 (need 50-80)","Мечтает всё бросить и уехать, но тратит полчаса на проверку, выключен ли утюг."
"mars_uranus","sagittarius_libra","103","full words: 96 (need 50-80); banned: ""энергия""","Ищет красивый способ быть правым и при этом не испортить ни с кем отношения."
"mars_uranus","sagittarius_scorpio","104","full words: 93 (need 50-80)","Его приключения — это всегда охота за чужими секретами, а не просто поиск впечат"
"mars_uranus","sagittarius_pisces","108","short words: 11 (need 12-25)","Может забыть о важной встрече, потому что увлёкся наблюдением за облаками."
"mars_uranus","capricorn_taurus","110","short words: 11 (need 12-25)","Упрямо идёт к цели проверенными методами, не отвлекаясь на сомнительные новшеств"
"mars_uranus","capricorn_leo","113","banned: ""ресурс""","Упорно идёт к цели, но хочет, чтобы этот путь заметили и оценили."
"mars_uranus","capricorn_virgo","114","short words: 11 (need 12-25); banned: ""будет""","Всё перепроверяет по несколько раз и не выносит спешки и небрежности."
"mars_uranus","capricorn_libra","115","short words: 9 (need 12-25)","Предпочитает добиваться своего без скандалов, терпеливо выжидая удобный момент."
"mars_uranus","capricorn_sagittarius","117","full words: 97 (need 50-80)","Долго выстраивает планы, а потом за вечер решает купить билет в другой конец све"
"mars_uranus","capricorn_capricorn","118","short words: 10 (need 12-25)","Перестраивает рабочие процессы вопреки устоявшимся правилам, но делает это метод"
"mars_uranus","capricorn_aquarius","119","short words: 11 (need 12-25)","Организовывает сообщества вокруг смелых идей, но требует от всех чёткого расписа"
"mars_uranus","aquarius_taurus","122","full words: 91 (need 50-80); banned: ""будет""","Может годами отстаивать свою точку зрения, но внезапно поменять ее за один разго"
"mars_uranus","aquarius_cancer","124","short words: 10 (need 12-25)","Внешне невозмутим, но внутри переживает бурю, которую редко кому показывает."
"mars_uranus","aquarius_leo","125","full words: 81 (need 50-80)","Уверен в своей непохожести, но болезненно реагирует, если кто-то её не замечает."
"mars_uranus","aquarius_virgo","126","short words: 9 (need 12-25)","Придумывает нестандартное решение, а потом долго проверяет каждую деталь."
"mars_uranus","aquarius_libra","127","short words: 10 (need 12-25); banned: ""быть собой""","Открыт к диалогу, но не позволит навязывать себе чужие правила."
"mars_uranus","aquarius_scorpio","128","short words: 11 (need 12-25)","Подмечает то, что другие упускают, и редко говорит всё, что думает."
"mars_uranus","pisces_aries","133","full words: 83 (need 50-80)","Может тихо мечтать о переменах, а потом резко сорваться с места и уехать в друго"
"mars_uranus","pisces_leo","137","short words: 11 (need 12-25)","Соглашается ради спокойствия, но внутри уже придумал, как сделать всё иначе."
"mars_uranus","pisces_pisces","144","short words: 10 (need 12-25)","Может часами размышлять о чём-то возвышенном, а потом забыть поесть."
"mars_venus","aries_aries","1","short words: 11 (need 12-25)","Вспыхивает мгновенно, действует первым, а о последствиях думает уже на бегу."
"mars_venus","aries_gemini","3","short words: 11 (need 12-25)","Вспыхивает новой идеей каждые полчаса и успевает заразить ею всех вокруг."
"mars_venus","aries_cancer","4","banned: ""будет""","Сначала лезет в драку, а потом долго переживает, не обидел ли кого случайно."
"mars_venus","aries_virgo","6","short words: 10 (need 12-25)","Сначала бросается в дело, а потом мучительно перепроверяет каждую деталь."
"mars_venus","aries_libra","7","short words: 9 (need 12-25); banned: ""энергия""","Хочет действовать быстро, но постоянно оглядывается на чужое мнение."
"mars_venus","aries_scorpio","8","short words: 9 (need 12-25)","Сначала действует, потом анализирует, но никогда не прощает предательства."
"mars_venus","aries_sagittarius","9","full words: 88 (need 50-80); banned: ""будет""","Может согласиться на авантюру за пять минут, а уже вечером разбираться с последс"
"mars_venus","aries_capricorn","10","full words: 94 (need 50-80); banned: ""будет""","Сначала оценит выгоду, потом включит энтузиазм — и будет работать до упора."
"mars_venus","aries_aquarius","11","full words: 82 (need 50-80)","Может часами спорить о теории заговора, а потом забыть, зачем вообще начал этот "
"mars_venus","aries_pisces","12","full words: 89 (need 50-80)","Может расплакаться из-за рекламы корма для собак, а через час уже спорить до хри"
"mars_venus","taurus_taurus","14","short words: 11 (need 12-25)","Упрямый, надёжный, не меняет решений без веских причин и ценит комфорт."
"mars_venus","taurus_gemini","15","short words: 11 (need 12-25)","Хочет устойчивости, но не может устоять перед новой идеей или разговором."
"mars_venus","taurus_cancer","16","short words: 10 (need 12-25)","Оберегает свой уклад и близких, реагирует медленно, но очень основательно."
"mars_venus","taurus_leo","17","short words: 11 (need 12-25)","Может долго раскачиваться, но выходить на сцену с уже готовым результатом."
"mars_venus","taurus_virgo","18","short words: 6 (need 12-25)","Лучше перепроверить трижды, чем потом переделывать."
"mars_venus","taurus_libra","19","short words: 9 (need 12-25)","Решения принимает медленно, зато так, чтобы никого не задеть."
"mars_venus","taurus_scorpio","20","short words: 9 (need 12-25)","Держит всё под контролем, но чувства иногда вырываются неожиданно."
"mars_venus","taurus_sagittarius","21","short words: 10 (need 12-25)","Мечтает о кругосветке, но не готов отказаться от любимого дивана."
"mars_venus","gemini_aries","25","full words: 49 (need 50-80)","Мгновенно загорается новой идеей и тут же начинает действовать, не дожидаясь гот"
"mars_venus","gemini_gemini","27","banned: ""будет""","Переключается между делами так быстро, что сам забывает, чем занимался пять мину"
"mars_venus","gemini_leo","29","banned: ""будет""","Способен увлечься новой идеей за секунду и тут же заразить ею всех вокруг."
"mars_venus","gemini_virgo","30","full words: 84 (need 50-80)","Сначала соберёт всю информацию по теме, а потом потратит ещё час на её проверку."
"mars_venus","gemini_libra","31","short words: 11 (need 12-25)","Легко поддерживает любой разговор, но избегает прямых ответов на неудобные вопро"
"mars_venus","gemini_sagittarius","33","banned: ""будет""","Готов в любую минуту отправиться в путешествие и увлечь за собой любого, кто не "
"mars_venus","gemini_capricorn","34","full words: 86 (need 50-80)","Держит эмоции под контролем, но внутри постоянно анализирует и ищет лучший вариа"
"mars_venus","gemini_pisces","36","full words: 86 (need 50-80)","Меняется как хамелеон: сначала смеётся, через минуту уже мечтает о чём-то далёко"
"mars_venus","cancer_taurus","38","banned: ""будет""","Он не любит спешить и предпочитает сначала всё обдумать, а потом уже действовать"
"mars_venus","cancer_scorpio","44","banned: ""глубина""","Переживает всё очень глубоко и остро, но редко показывает это даже самым близким"
"mars_venus","cancer_sagittarius","45","short words: 9 (need 12-25); full words: 40 (need 50-80)","Сначала кажется закрытым, но быстро раскрывается, если почувствует интерес."
"mars_venus","cancer_capricorn","46","short words: 8 (need 12-25); full words: 39 (need 50-80)","Привык сначала всё обдумывать, а потом уже действовать."
"mars_venus","cancer_aquarius","47","short words: 9 (need 12-25); full words: 42 (need 50-80); banned: ""быть собой""","Может долго сохранять спокойствие, даже когда внутри всё кипит."
"mars_venus","cancer_pisces","48","short words: 8 (need 12-25); full words: 39 (need 50-80); banned: ""ресурс""","Легко считывает настроение других и подстраивается под него."
"mars_venus","leo_aries","49","short words: 11 (need 12-25); full words: 92 (need 50-80)","Зажигает вечеринку, но готов уйти, если его не заметят среди первых."
"mars_venus","leo_taurus","50","full words: 99 (need 50-80)","Любит быть в центре, но только если вокруг мягкий диван и проверенные люди."
"mars_venus","leo_gemini","51","full words: 84 (need 50-80); banned: ""будет""","Заводит толпу за пять минут, а через час уже удивляется, куда делись все."
"mars_venus","leo_cancer","52","full words: 91 (need 50-80); banned: ""будет""","Гремит на весь зал, но дома тихо ждёт, что его погладят по голове."
"mars_venus","leo_scorpio","56","short words: 11 (need 12-25); banned: ""энергия""","Притягивает внимание магнетической уверенностью и не прощает предательства, треб"
"mars_venus","leo_capricorn","58","short words: 11 (need 12-25)","Сначала построит карьеру и только потом позволит себе расслабиться на отдыхе."
"mars_venus","virgo_taurus","62","banned: ""ресурс""","Долго выбирает между двумя одинаковыми банками огурцов, потому что одна стоит на"
"mars_venus","virgo_libra","67","short words: 10 (need 12-25)","Замечает все недостатки, но предпочитает указывать на них максимально деликатно."
"mars_venus","virgo_scorpio","68","short words: 11 (need 12-25)","Долго присматривается к людям, но если доверится — предан до конца."
"mars_venus","virgo_capricorn","70","short words: 11 (need 12-25)","Составит расписание на год вперёд и расстроится, если придётся его менять."
"mars_venus","virgo_aquarius","71","banned: ""будет""","Сначала придумает гениальный план, а потом забудет, зачем он вообще это затеял."
"mars_venus","virgo_pisces","72","short words: 11 (need 12-25)","Может часами разбирать чужие проблемы, но в своих чувствах путается моментально."
"mars_venus","libra_taurus","74","short words: 11 (need 12-25)","Внешне уступчивый, но внутри — гранитная скала: переубедить его почти невозможно"
"mars_venus","libra_cancer","76","full words: 81 (need 50-80)","Сначала старается угодить всем, а потом незаметно для других приводит всё к свое"
"mars_venus","libra_libra","79","short words: 11 (need 12-25)","Чаще соглашается, чем спорит, но потом долго переживает, правильно ли поступил."
"mars_venus","libra_pisces","84","short words: 11 (need 12-25)","Старается сгладить любой конфликт, потому что чужую боль чувствует как свою."
"mars_venus","scorpio_gemini","87","banned: ""энергия""","Может увлечённо спорить до хрипоты, а через час забыть о предмете ссоры."
"mars_venus","scorpio_virgo","90","banned: ""будет""","Всё проверяет по нескольку раз, но делает это не из занудства, а из страха ошиби"
"mars_venus","scorpio_libra","91","short words: 11 (need 12-25)","Обходительный и дипломатичный, он способен месяцами вынашивать план, чтобы добит"
"mars_venus","sagittarius_aries","97","short words: 10 (need 12-25)","Готов сорваться в любую авантюру, даже не успев допить кофе."
"mars_venus","sagittarius_taurus","98","full words: 85 (need 50-80)","Готов махнуть в путешествие, но только с хорошим матрасом и запасом вкусной еды."
"mars_venus","sagittarius_gemini","99","full words: 81 (need 50-80)","Может заговорить с незнакомцем в лифте и к третьему этажу узнать всю его биограф"
"mars_venus","sagittarius_cancer","100","short words: 11 (need 12-25); full words: 87 (need 50-80)","Тянет в путешествия, но без домашнего плова и пледа ему тоскливо."
"mars_venus","sagittarius_leo","101","short words: 11 (need 12-25)","Готов ввязаться в авантюру, если она сулит аплодисменты и огни рампы."
"mars_venus","sagittarius_virgo","102","short words: 10 (need 12-25); banned: ""будет""","Готов покорять вершины, но сначала трижды проверит снаряжение и маршрут."
"mars_venus","sagittarius_libra","103","short words: 11 (need 12-25); banned: ""будет""","С энтузиазмом предлагает десяток планов, но выбирает тот, который понравится все"
"mars_venus","sagittarius_sagittarius","105","full words: 85 (need 50-80)","Он всегда в движении: новая идея каждую минуту, ни одной доведённой до конца."
"mars_venus","sagittarius_capricorn","106","short words: 10 (need 12-25); full words: 82 (need 50-80)","Он хочет покорить мир, но сначала составит подробный график покорения."
"mars_venus","sagittarius_aquarius","107","banned: ""будет""","Он ценит свободу и нестандартные идеи, но может забыть спросить, как у тебя дела"
"mars_venus","sagittarius_pisces","108","full words: 92 (need 50-80); banned: ""будет""","Он верит в чудеса и легко увлекается мечтами, но быстро теряет интерес к реально"
"mars_venus","capricorn_aries","109","full words: 88 (need 50-80)","На первый взгляд сдержан, но внутри тлеет огонь, готовый вспыхнуть внезапно и яр"
"mars_venus","capricorn_taurus","110","full words: 84 (need 50-80)","Готов работать над одной целью годами, не отвлекаясь, и ценит надёжность превыше"
"mars_venus","capricorn_aquarius","119","short words: 11 (need 12-25)","Спокойно планирует, но в последний момент может сорваться в неожиданную авантюру"
"mars_venus","capricorn_pisces","120","full words: 86 (need 50-80)","Он надёжный и практичный, но при этом тонко чувствует настроение других и редко "
"mars_venus","aquarius_aries","121","full words: 87 (need 50-80)","Сначала ввязывается в эксперимент, а потом уже думает, стоило ли оно того."
"mars_venus","aquarius_taurus","122","full words: 90 (need 50-80)","Может быть консервативным в мелочах и радикальным в глобальных идеях — это его н"
"mars_venus","aquarius_cancer","124","full words: 89 (need 50-80)","Внешне независимый, но внутри очень ранимый — он долго не показывает, что его за"
